{
  "trace_id": "trace://fixture/tenant-differs",
  "schema_version": "ate/0.4",
  "run_id": "run-fixture-tenant-differs",
  "tenant_id": "f92c9dba-50f1-4cad-9690-5d79f8ded335",
  "agent_id": "liam",
  "proposal_hash": "a677e257b2128f7c6bb38ed21741f1f66f623b18cdec8e6bfd6fb460d16354bb",
  "created_at": "2026-01-01T00:00:00Z"
}
